age-group,gender,cumulativeScore,category,programName,heading1,description1,heading2,description2,heading3,description3
0-10,Male,0,memory,"Memory Master Series","Module 1: Sensory Play","Engage in sensory activities to stimulate memory.","Module 2: Simple Routines","Establish consistent daily routines.","Module 3: Musical Games","Use songs to enhance auditory memory."
0-10,Male,1,memory,"Memory Master Series","Module 1: Matching Games","Play simple matching card games.","Module 2: Storytelling","Read short stories and discuss them.","Module 3: Visual Aids","Use colorful images to reinforce memory."
0-10,Male,2,memory,"Memory Master Series","Module 1: Building Blocks","Construct structures to improve spatial memory.","Module 2: Repetition Activities","Repeat actions to strengthen recall.","Module 3: Interactive Reading","Ask questions during story time."
0-10,Male,3,memory,"Memory Master Series","Module 1: Sequence Games","Arrange objects in order and recall sequence.","Module 2: Simple Puzzles","Solve age-appropriate puzzles.","Module 3: Rhyming Songs","Use rhymes to enhance memory."
0-10,Male,4,memory,"Memory Master Series","Module 1: Story Retelling","Encourage retelling of favorite stories.","Module 2: Memory Games","Play games that require remembering details.","Module 3: Art Projects","Draw scenes from stories."
0-10,Male,5,memory,"Memory Master Series","Module 1: Enhanced Puzzles","Introduce more complex puzzles.","Module 2: Memory Challenges","Set up memory treasure hunts.","Module 3: Educational Songs","Learn songs with educational content."
0-10,Male,6,memory,"Memory Master Series","Module 1: Simple Coding","Introduce basic coding concepts with toys.","Module 2: Math Games","Play games that involve numbers and counting.","Module 3: Memory Recall","Practice recalling daily events."
0-10,Male,7,memory,"Memory Master Series","Module 1: Foreign Language Basics","Learn basic words in a new language.","Module 2: Strategy Games","Start playing simple strategy board games.","Module 3: Science Exploration","Conduct simple experiments."
0-10,Male,8,memory,"Memory Master Series","Module 1: Complex Stories","Read longer stories and discuss plots.","Module 2: Creative Writing","Encourage writing short sentences or stories.","Module 3: Group Activities","Participate in group memory games."
0-10,Male,9,memory,"Memory Master Series","Module 1: Advanced Memory Games","Play memory games with multiple elements.","Module 2: Problem Solving","Introduce basic problem-solving tasks.","Module 3: Project Creation","Work on small projects that require planning."
0-10,Male,10,memory,"Memory Master Series","Module 1: Memory Mastery","Engage in activities that challenge memory extensively.","Module 2: Leadership in Games","Lead group activities or games.","Module 3: Independent Projects","Start independent learning projects."
0-10,Female,0,memory,"Memory Master Series","Module 1: Sensory Activities","Use sensory bins to stimulate memory.","Module 2: Simple Songs","Sing songs with repetitive lyrics.","Module 3: Routine Charts","Create visual schedules for routines."
0-10,Female,1,memory,"Memory Master Series","Module 1: Picture Books","Explore books with vivid images.","Module 2: Matching Games","Play matching games with images or words.","Module 3: Storytelling Participation","Encourage participation during story time."
0-10,Female,2,memory,"Memory Master Series","Module 1: Dress-Up Play","Use costumes to act out stories.","Module 2: Simple Crafts","Engage in crafts that require following steps.","Module 3: Repetition in Play","Repeat play sequences to enhance memory."
0-10,Female,3,memory,"Memory Master Series","Module 1: Sequence Songs","Learn songs that build in sequences.","Module 2: Puppet Shows","Create simple puppet shows from stories.","Module 3: Memory Cards","Use cards to match and recall images."
0-10,Female,4,memory,"Memory Master Series","Module 1: Story Sequencing","Arrange story events in order.","Module 2: Rhyming Games","Play games that focus on rhyming words.","Module 3: Collaborative Projects","Work on group crafts or activities."
0-10,Female,5,memory,"Memory Master Series","Module 1: Detailed Drawing","Draw detailed pictures from memory.","Module 2: Educational Songs","Sing songs that teach concepts.","Module 3: Memory Challenges","Set up scavenger hunts with clues."
0-10,Female,6,memory,"Memory Master Series","Module 1: Basic Coding Toys","Use toys that introduce coding logic.","Module 2: Number Games","Play games involving basic math.","Module 3: Daily Journaling","Start a simple picture journal."
0-10,Female,7,memory,"Memory Master Series","Module 1: Language Learning","Learn simple phrases in another language.","Module 2: Strategy Puzzles","Work on puzzles that require strategy.","Module 3: Science Experiments","Conduct simple, guided experiments."
0-10,Female,8,memory,"Memory Master Series","Module 1: Chapter Books","Begin reading introductory chapter books.","Module 2: Writing Stories","Encourage writing short stories.","Module 3: Memory Teams","Participate in team-based memory games."
0-10,Female,9,memory,"Memory Master Series","Module 1: Advanced Crafts","Create crafts that require following complex instructions.","Module 2: Logic Games","Play games that enhance logical thinking.","Module 3: Independent Research","Explore topics of interest in more depth."
0-10,Female,10,memory,"Memory Master Series","Module 1: Memory Expert Activities","Engage in activities designed for advanced memory skills.","Module 2: Leadership Roles","Take on leadership in group settings.","Module 3: Creative Projects","Initiate and complete creative projects independently."
10-20,Male,0,memory,"Memory Master Series","Module 1: Study Skills Foundation","Learn basic study techniques to improve memory.","Module 2: Active Engagement","Participate actively in class to enhance retention.","Module 3: Healthy Habits","Emphasize sleep and nutrition for better memory."
10-20,Male,1,memory,"Memory Master Series","Module 1: Effective Note-Taking","Practice note-taking methods to enhance recall.","Module 2: Flashcards Usage","Use flashcards for key terms and concepts.","Module 3: Group Study","Collaborate with peers for shared learning."
10-20,Male,2,memory,"Memory Master Series","Module 1: Mind Mapping","Use mind maps to organize information visually.","Module 2: Repetition Techniques","Review material regularly for better retention.","Module 3: Focused Reading","Develop reading strategies for comprehension."
10-20,Male,3,memory,"Memory Master Series","Module 1: Mnemonic Devices","Learn mnemonic techniques to memorize information.","Module 2: Teaching Others","Explain concepts to others to reinforce memory.","Module 3: Digital Tools","Utilize apps designed to aid memory."
10-20,Male,4,memory,"Memory Master Series","Module 1: Visualization Skills","Visualize information to improve recall.","Module 2: Practice Tests","Take practice exams to test memory.","Module 3: Time Management","Organize study time efficiently."
10-20,Male,5,memory,"Memory Master Series","Module 1: Chunking Information","Break down large information into smaller chunks.","Module 2: Association Techniques","Associate new information with known concepts.","Module 3: Healthy Lifestyle","Maintain regular exercise and balanced diet."
10-20,Male,6,memory,"Memory Master Series","Module 1: Elaborative Rehearsal","Expand on information to deepen memory.","Module 2: Mindfulness Meditation","Practice mindfulness to enhance focus and memory.","Module 3: Language Learning","Begin learning a new language."
10-20,Male,7,memory,"Memory Master Series","Module 1: Advanced Study Methods","Implement spaced repetition in studying.","Module 2: Cognitive Exercises","Engage in activities like puzzles and chess.","Module 3: Leadership Roles","Take on roles that challenge memory skills."
10-20,Male,8,memory,"Memory Master Series","Module 1: Interdisciplinary Learning","Connect concepts across different subjects.","Module 2: Research Projects","Undertake projects that require extensive memory.","Module 3: Physical Wellness","Continue to prioritize physical health."
10-20,Male,9,memory,"Memory Master Series","Module 1: Memory Competitions","Participate in memory or academic competitions.","Module 2: Mentorship","Seek mentorship to further develop skills.","Module 3: Advanced Learning","Engage in college-level courses."
10-20,Male,10,memory,"Memory Master Series","Module 1: Independent Research","Conduct independent study on topics of interest.","Module 2: Teaching Assistant","Assist teachers to deepen understanding.","Module 3: Scholarly Publications","Aim to publish articles or papers."
10-20,Female,0,memory,"Memory Master Series","Module 1: Study Foundations","Develop effective study habits early on.","Module 2: Active Participation","Engage actively in classroom discussions.","Module 3: Sleep Hygiene","Ensure adequate sleep for memory consolidation."
10-20,Female,1,memory,"Memory Master Series","Module 1: Organizational Skills","Use planners and calendars to track assignments.","Module 2: Visual Learning","Incorporate visual aids like charts and diagrams.","Module 3: Peer Collaboration","Study with peers to enhance learning."
10-20,Female,2,memory,"Memory Master Series","Module 1: Effective Reading","Practice active reading strategies.","Module 2: Self-Quizzing","Test yourself regularly on the material.","Module 3: Nutritional Focus","Eat brain-healthy foods."
10-20,Female,3,memory,"Memory Master Series","Module 1: Mnemonic Strategies","Use acronyms and associations for memorization.","Module 2: Teaching Others","Explain concepts to friends or family.","Module 3: Stress Management","Learn techniques to reduce stress."
10-20,Female,4,memory,"Memory Master Series","Module 1: Mind Mapping","Organize notes visually through mind maps.","Module 2: Regular Reviews","Schedule consistent study sessions.","Module 3: Extracurricular Activities","Engage in activities that challenge the mind."
10-20,Female,5,memory,"Memory Master Series","Module 1: Elaborative Interrogation","Ask questions to deepen understanding.","Module 2: Healthy Habits","Maintain a balanced diet and exercise routine.","Module 3: Time Allocation","Prioritize tasks effectively."
10-20,Female,6,memory,"Memory Master Series","Module 1: Cognitive Techniques","Employ advanced memory techniques.","Module 2: Leadership Opportunities","Take on leadership roles in clubs or teams.","Module 3: Mindfulness Practices","Incorporate mindfulness meditation."
10-20,Female,7,memory,"Memory Master Series","Module 1: Dual Coding","Combine words and visuals to enhance memory.","Module 2: Advanced Academics","Enroll in advanced placement courses.","Module 3: Language Acquisition","Learn a new language to boost cognition."
10-20,Female,8,memory,"Memory Master Series","Module 1: Research Skills","Develop skills to conduct academic research.","Module 2: Peer Tutoring","Tutor others to reinforce knowledge.","Module 3: Physical Activity","Engage in regular physical exercise."
10-20,Female,9,memory,"Memory Master Series","Module 1: Scholarly Engagement","Participate in academic clubs or societies.","Module 2: Presentation Skills","Improve memory through public speaking.","Module 3: Healthy Balance","Maintain mental and physical wellness."
10-20,Female,10,memory,"Memory Master Series","Module 1: Independent Studies","Pursue independent research projects.","Module 2: Academic Competitions","Compete in science fairs or debates.","Module 3: Publication Goals","Aim to publish in youth journals."
20-30,Male,0,memory,"Memory Master Series","Module 1: Study Foundations","Reinforce basic study and memory skills.","Module 2: Healthy Habits","Establish regular sleep and exercise routines.","Module 3: Stress Management","Learn techniques to manage stress and improve memory."
20-30,Male,1,memory,"Memory Master Series","Module 1: Effective Note-Taking","Improve note-taking methods to enhance recall.","Module 2: Active Participation","Engage actively during learning sessions.","Module 3: Time Allocation","Prioritize tasks to optimize study time."
20-30,Male,2,memory,"Memory Master Series","Module 1: Mind Mapping","Use mind maps to organize information visually.","Module 2: Flashcards","Utilize flashcards for key concepts.","Module 3: Group Discussions","Participate in study groups to enhance understanding."
20-30,Male,3,memory,"Memory Master Series","Module 1: Mnemonic Devices","Apply mnemonic techniques for better memorization.","Module 2: Regular Reviews","Schedule periodic reviews of material.","Module 3: Healthy Lifestyle","Maintain balanced diet and exercise routinely."
20-30,Male,4,memory,"Memory Master Series","Module 1: Visualization Techniques","Visualize information to strengthen memory.","Module 2: Practice Tests","Take practice exams to assess retention.","Module 3: Sleep Optimization","Ensure adequate sleep for memory consolidation."
20-30,Male,5,memory,"Memory Master Series","Module 1: Chunking Information","Break down complex information into chunks.","Module 2: Teaching Others","Explain topics to peers to reinforce knowledge.","Module 3: Digital Tools","Use apps and technology to aid memory."
20-30,Male,6,memory,"Memory Master Series","Module 1: Elaborative Rehearsal","Deepen understanding by expanding on material.","Module 2: Mindfulness Meditation","Practice mindfulness to improve focus and memory.","Module 3: Language Learning","Learn a new language to enhance cognitive skills."
20-30,Male,7,memory,"Memory Master Series","Module 1: Advanced Study Techniques","Implement spaced repetition and interleaving.","Module 2: Cognitive Exercises","Engage in activities like puzzles and strategy games.","Module 3: Leadership Roles","Take on roles that challenge memory and responsibility."
20-30,Male,8,memory,"Memory Master Series","Module 1: Research Skills","Develop skills to conduct in-depth research.","Module 2: Professional Development","Attend workshops and seminars in your field.","Module 3: Physical Fitness","Maintain an active lifestyle to support brain health."
20-30,Male,9,memory,"Memory Master Series","Module 1: Creative Thinking","Use creativity to solve problems and remember concepts.","Module 2: Networking","Connect with professionals to exchange knowledge.","Module 3: Advanced Mindfulness","Deepen meditation practice for cognitive benefits."
20-30,Male,10,memory,"Memory Master Series","Module 1: Expert Memory Techniques","Master advanced techniques like the memory palace.","Module 2: Teaching and Mentoring","Mentor others to solidify your own understanding.","Module 3: Lifelong Learning","Commit to continuous education and skill development."
20-30,Female,0,memory,"Memory Master Series","Module 1: Study Habits","Establish effective study routines.","Module 2: Organizational Skills","Use planners and organizers to track tasks.","Module 3: Self-Care","Focus on sleep and nutrition for better memory."
20-30,Female,1,memory,"Memory Master Series","Module 1: Active Engagement","Participate fully in learning activities.","Module 2: Note-Taking Strategies","Improve note-taking to enhance recall.","Module 3: Time Management","Allocate time efficiently for studies."
20-30,Female,2,memory,"Memory Master Series","Module 1: Visual Learning","Incorporate charts and diagrams into study.","Module 2: Flashcards","Use flashcards for memorization of key terms.","Module 3: Study Groups","Collaborate with peers to deepen understanding."
20-30,Female,3,memory,"Memory Master Series","Module 1: Mnemonic Methods","Learn mnemonic devices to aid memory.","Module 2: Regular Review Sessions","Schedule consistent study reviews.","Module 3: Physical Wellness","Maintain exercise for cognitive health."
20-30,Female,4,memory,"Memory Master Series","Module 1: Conceptual Understanding","Focus on grasping underlying concepts.","Module 2: Practice Quizzes","Test retention with self-made quizzes.","Module 3: Stress Reduction","Implement techniques to manage stress."
20-30,Female,5,memory,"Memory Master Series","Module 1: Elaborative Techniques","Expand on material to deepen understanding.","Module 2: Teach Others","Explain concepts to reinforce memory.","Module 3: Healthy Living","Promote a balanced lifestyle."
20-30,Female,6,memory,"Memory Master Series","Module 1: Cognitive Training","Engage in brain-training exercises.","Module 2: Mindfulness Practices","Incorporate meditation to enhance focus.","Module 3: Advanced Planning","Plan studies strategically."
20-30,Female,7,memory,"Memory Master Series","Module 1: Advanced Learning Methods","Use techniques like spaced repetition.","Module 2: Professional Networking","Connect with others in your field.","Module 3: Mentorship","Seek mentorship for growth."
20-30,Female,8,memory,"Memory Master Series","Module 1: Research and Analysis","Develop strong research skills.","Module 2: Skill Development","Take courses to enhance abilities.","Module 3: Physical Health","Maintain fitness to support cognition."
20-30,Female,9,memory,"Memory Master Series","Module 1: Leadership Development","Assume leadership roles in projects.","Module 2: Knowledge Sharing","Present at workshops or seminars.","Module 3: Advanced Mindfulness","Deepen mindfulness for cognitive benefits."
20-30,Female,10,memory,"Memory Master Series","Module 1: Expert Memory Strategies","Master techniques like the Method of Loci.","Module 2: Thought Leadership","Contribute to your field through writing or speaking.","Module 3: Lifelong Learning","Commit to continuous personal and professional development."
20-30,Male,0,memory,"Memory Master Series","Module 1: Study Foundations","Reinforce basic study and memory skills.","Module 2: Healthy Habits","Establish regular sleep and exercise routines.","Module 3: Stress Management","Learn techniques to manage stress and improve memory."
20-30,Male,1,memory,"Memory Master Series","Module 1: Effective Note-Taking","Improve note-taking methods to enhance recall.","Module 2: Active Participation","Engage actively during learning sessions.","Module 3: Time Allocation","Prioritize tasks to optimize study time."
20-30,Male,2,memory,"Memory Master Series","Module 1: Mind Mapping","Use mind maps to organize information visually.","Module 2: Flashcards","Utilize flashcards for key concepts.","Module 3: Group Discussions","Participate in study groups to enhance understanding."
20-30,Male,3,memory,"Memory Master Series","Module 1: Mnemonic Devices","Apply mnemonic techniques for better memorization.","Module 2: Regular Reviews","Schedule periodic reviews of material.","Module 3: Healthy Lifestyle","Maintain balanced diet and exercise routinely."
20-30,Male,4,memory,"Memory Master Series","Module 1: Visualization Techniques","Visualize information to strengthen memory.","Module 2: Practice Tests","Take practice exams to assess retention.","Module 3: Sleep Optimization","Ensure adequate sleep for memory consolidation."
20-30,Male,5,memory,"Memory Master Series","Module 1: Chunking Information","Break down complex information into chunks.","Module 2: Teaching Others","Explain topics to peers to reinforce knowledge.","Module 3: Digital Tools","Use apps and technology to aid memory."
20-30,Male,6,memory,"Memory Master Series","Module 1: Elaborative Rehearsal","Deepen understanding by expanding on material.","Module 2: Mindfulness Meditation","Practice mindfulness to improve focus and memory.","Module 3: Language Learning","Learn a new language to enhance cognitive skills."
20-30,Male,7,memory,"Memory Master Series","Module 1: Advanced Study Techniques","Implement spaced repetition and interleaving.","Module 2: Cognitive Exercises","Engage in activities like puzzles and strategy games.","Module 3: Leadership Roles","Take on roles that challenge memory and responsibility."
20-30,Male,8,memory,"Memory Master Series","Module 1: Research Skills","Develop skills to conduct in-depth research.","Module 2: Professional Development","Attend workshops and seminars in your field.","Module 3: Physical Fitness","Maintain an active lifestyle to support brain health."
20-30,Male,9,memory,"Memory Master Series","Module 1: Creative Thinking","Use creativity to solve problems and remember concepts.","Module 2: Networking","Connect with professionals to exchange knowledge.","Module 3: Advanced Mindfulness","Deepen meditation practice for cognitive benefits."
20-30,Male,10,memory,"Memory Master Series","Module 1: Expert Memory Techniques","Master advanced techniques like the memory palace.","Module 2: Teaching and Mentoring","Mentor others to solidify your own understanding.","Module 3: Lifelong Learning","Commit to continuous education and skill development."
20-30,Female,0,memory,"Memory Master Series","Module 1: Study Habits","Establish effective study routines.","Module 2: Organizational Skills","Use planners and organizers to track tasks.","Module 3: Self-Care","Focus on sleep and nutrition for better memory."
20-30,Female,1,memory,"Memory Master Series","Module 1: Active Engagement","Participate fully in learning activities.","Module 2: Note-Taking Strategies","Improve note-taking to enhance recall.","Module 3: Time Management","Allocate time efficiently for studies."
20-30,Female,2,memory,"Memory Master Series","Module 1: Visual Learning","Incorporate charts and diagrams into study.","Module 2: Flashcards","Use flashcards for memorization of key terms.","Module 3: Study Groups","Collaborate with peers to deepen understanding."
20-30,Female,3,memory,"Memory Master Series","Module 1: Mnemonic Methods","Learn mnemonic devices to aid memory.","Module 2: Regular Review Sessions","Schedule consistent study reviews.","Module 3: Physical Wellness","Maintain exercise for cognitive health."
20-30,Female,4,memory,"Memory Master Series","Module 1: Conceptual Understanding","Focus on grasping underlying concepts.","Module 2: Practice Quizzes","Test retention with self-made quizzes.","Module 3: Stress Reduction","Implement techniques to manage stress."
20-30,Female,5,memory,"Memory Master Series","Module 1: Elaborative Techniques","Expand on material to deepen understanding.","Module 2: Teach Others","Explain concepts to reinforce memory.","Module 3: Healthy Living","Promote a balanced lifestyle."
20-30,Female,6,memory,"Memory Master Series","Module 1: Cognitive Training","Engage in brain-training exercises.","Module 2: Mindfulness Practices","Incorporate meditation to enhance focus.","Module 3: Advanced Planning","Plan studies strategically."
20-30,Female,7,memory,"Memory Master Series","Module 1: Advanced Learning Methods","Use techniques like spaced repetition.","Module 2: Professional Networking","Connect with others in your field.","Module 3: Mentorship","Seek mentorship for growth."
20-30,Female,8,memory,"Memory Master Series","Module 1: Research and Analysis","Develop strong research skills.","Module 2: Skill Development","Take courses to enhance abilities.","Module 3: Physical Health","Maintain fitness to support cognition."
20-30,Female,9,memory,"Memory Master Series","Module 1: Leadership Development","Assume leadership roles in projects.","Module 2: Knowledge Sharing","Present at workshops or seminars.","Module 3: Advanced Mindfulness","Deepen mindfulness for cognitive benefits."
20-30,Female,10,memory,"Memory Master Series","Module 1: Expert Memory Strategies","Master techniques like the Method of Loci.","Module 2: Thought Leadership","Contribute to your field through writing or speaking.","Module 3: Lifelong Learning","Commit to continuous personal and professional development."
30-40,Male,0,memory,"Memory Master Series","Module 1: Healthy Lifestyle","Focus on sleep, nutrition, and exercise to support memory.","Module 2: Organizational Skills","Use planners and digital tools to track tasks.","Module 3: Stress Management","Implement stress reduction techniques to improve memory."
30-40,Male,1,memory,"Memory Master Series","Module 1: Time Management","Prioritize tasks to reduce cognitive load.","Module 2: Active Learning","Engage in workshops and seminars.","Module 3: Brain Games","Play memory-enhancing games regularly."
30-40,Male,2,memory,"Memory Master Series","Module 1: Continuous Learning","Enroll in courses to learn new skills.","Module 2: Mind Mapping","Use mind maps for project planning and idea organization.","Module 3: Social Engagement","Join professional groups for intellectual stimulation."
30-40,Male,3,memory,"Memory Master Series","Module 1: Advanced Note-Taking","Refine note-taking to improve information retention.","Module 2: Teaching Others","Mentor colleagues to reinforce knowledge.","Module 3: Physical Activity","Maintain regular exercise for brain health."
30-40,Male,4,memory,"Memory Master Series","Module 1: Mindfulness Meditation","Incorporate meditation to enhance focus and memory.","Module 2: Memory Techniques","Practice mnemonic devices and visualization methods.","Module 3: Healthy Diet","Consume foods that promote cognitive function."
30-40,Male,5,memory,"Memory Master Series","Module 1: Cognitive Training","Engage in brain-training exercises and apps.","Module 2: Professional Development","Attend advanced training in your field.","Module 3: Challenging Hobbies","Pursue hobbies that stimulate the mind."
30-40,Male,6,memory,"Memory Master Series","Module 1: Advanced Education","Pursue higher education or certifications.","Module 2: Complex Projects","Lead projects requiring strategic thinking.","Module 3: Networking","Expand professional connections and networks."
30-40,Male,7,memory,"Memory Master Series","Module 1: Leadership Roles","Assume leadership positions to enhance memory through responsibility.","Module 2: Public Speaking","Engage in speaking engagements to improve recall.","Module 3: Advanced Mindfulness","Deepen mindfulness practices for cognitive benefits."
