age-group,gender,cumulativeScore,category,programName,heading1,description1,heading2,description2,heading3,description3
70-80,Female,5,memory,"Memory Master Series","Module 1: Creative Arts","Engage in arts, crafts, or writing.","Module 2: Gentle Yoga","Practice gentle yoga or stretching.","Module 3: Social Clubs","Join senior groups or clubs for interaction."
70-80,Female,6,memory,"Memory Master Series","Module 1: Cultural Engagement","Attend local events or exhibitions.","Module 2: Challenging Games","Play more challenging puzzles or games.","Module 3: Language Activities","Practice language or word games."
70-80,Female,7,memory,"Memory Master Series","Module 1: Teaching and Sharing","Teach others skills or knowledge you possess.","Module 2: Technology Learning","Learn to use technology for connection.","Module 3: Physical Activity","Maintain a regular, suitable exercise routine."
70-80,Female,8,memory,"Memory Master Series","Module 1: Volunteer Participation","Engage in volunteer work meaningful to you.","Module 2: Intellectual Pursuits","Join book clubs or discussion groups.","Module 3: Mind-Body Wellness","Practice tai chi or similar exercises."
70-80,Female,9,memory,"Memory Master Series","Module 1: Continued Education","Take up courses in areas of interest.","Module 2: Leadership Opportunities","Lead or organize community activities.","Module 3: Memory Enhancement","Use advanced memory techniques."
70-80,Female,10,memory,"Memory Master Series","Module 1: Legacy Creation","Work on projects important to you for legacy building.","Module 2: Mentorship Roles","Mentor younger individuals or groups.","Module 3: Global Involvement","Participate in global or humanitarian causes."
80-100,Male,0,memory,"Memory Master Series","Module 1: Medical Consultation","Consult a healthcare provider about memory concerns.","Module 2: Routine Establishment","Create consistent daily routines to aid memory.","Module 3: Stress Reduction","Engage in relaxation techniques like deep breathing."
80-100,Male,1,memory,"Memory Master Series","Module 1: Gentle Physical Activity","Engage in light exercises such as walking.","Module 2: Balanced Nutrition","Focus on a diet rich in brain-healthy foods.","Module 3: Sleep Hygiene","Ensure adequate and restful sleep."
80-100,Male,2,memory,"Memory Master Series","Module 1: Social Engagement","Interact regularly with friends and family.","Module 2: Mental Stimulation","Engage in simple puzzles and memory games.","Module 3: Mindfulness Practice","Incorporate mindfulness or meditation."
80-100,Male,3,memory,"Memory Master Series","Module 1: Hobby Exploration","Pursue hobbies that interest you to stimulate memory.","Module 2: Memory Aids","Use reminders and notes to support memory.","Module 3: Music Therapy","Listen to music to enhance cognitive function."
80-100,Male,4,memory,"Memory Master Series","Module 1: Light Group Activities","Participate in group activities suitable for your abilities.","Module 2: Storytelling","Share personal stories to exercise memory.","Module 3: Adequate Hydration","Stay hydrated for optimal brain function."
80-100,Male,5,memory,"Memory Master Series","Module 1: Creative Expression","Engage in art or crafts to stimulate the mind.","Module 2: Gentle Yoga","Practice chair yoga or stretching for mind-body connection.","Module 3: Brain Games","Play easy brain games regularly."
80-100,Male,6,memory,"Memory Master Series","Module 1: Reading","Read books or articles to maintain cognitive skills.","Module 2: Social Clubs","Join senior clubs to remain socially active.","Module 3: Healthy Lifestyle","Maintain healthy habits to support memory."
80-100,Male,7,memory,"Memory Master Series","Module 1: Language Practice","Engage in activities that involve language skills.","Module 2: Nature Walks","Take short walks in nature for mental well-being.","Module 3: Volunteer Opportunities","Participate in volunteer work suitable for you."
80-100,Male,8,memory,"Memory Master Series","Module 1: Teaching Others","Share your knowledge and experiences with others.","Module 2: Advanced Puzzles","Challenge yourself with appropriate puzzles.","Module 3: Cultural Activities","Attend concerts or exhibitions if possible."
80-100,Male,9,memory,"Memory Master Series","Module 1: Mentorship","Mentor younger individuals to pass on wisdom.","Module 2: Lifelong Learning","Engage in learning new topics of interest.","Module 3: Community Involvement","Stay involved in community events."
80-100,Male,10,memory,"Memory Master Series","Module 1: Legacy Projects","Work on projects to leave a lasting legacy.","Module 2: Writing Memoirs","Document your life stories and experiences.","Module 3: Advanced Social Engagement","Lead discussions or groups on topics you are passionate about."
80-100,Female,0,memory,"Memory Master Series","Module 1: Medical Evaluation","Discuss memory concerns with a healthcare provider.","Module 2: Routine Activities","Maintain consistent daily activities.","Module 3: Relaxation Techniques","Practice deep breathing or meditation."
80-100,Female,1,memory,"Memory Master Series","Module 1: Light Exercise","Engage in gentle exercises like walking or stretching.","Module 2: Nutrient-Rich Diet","Focus on wholesome foods for brain health.","Module 3: Good Sleep Practices","Ensure sufficient and restful sleep."
80-100,Female,2,memory,"Memory Master Series","Module 1: Social Interaction","Connect regularly with loved ones.","Module 2: Cognitive Activities","Engage in simple memory games or puzzles.","Module 3: Mindfulness","Practice mindfulness to enhance focus."
80-100,Female,3,memory,"Memory Master Series","Module 1: Hobbies","Participate in hobbies like knitting or painting.","Module 2: Memory Support","Use calendars and notes as memory aids.","Module 3: Music Enjoyment","Listen to music to stimulate the mind."
80-100,Female,4,memory,"Memory Master Series","Module 1: Group Activities","Join group classes or gatherings suitable for you.","Module 2: Story Sharing","Share stories to keep the mind active.","Module 3: Stay Hydrated","Maintain proper hydration for brain function."
80-100,Female,5,memory,"Memory Master Series","Module 1: Creative Arts","Engage in creative projects like scrapbooking.","Module 2: Gentle Yoga","Practice seated yoga or tai chi for calmness.","Module 3: Mind Games","Play simple mind games regularly."
80-100,Female,6,memory,"Memory Master Series","Module 1: Reading","Read books, poems, or magazines you enjoy.","Module 2: Social Groups","Participate in senior social groups.","Module 3: Healthy Living","Continue healthy habits for cognitive support."
80-100,Female,7,memory,"Memory Master Series","Module 1: Language Activities","Enjoy word games or storytelling.","Module 2: Nature Activities","Spend time outdoors as able for mental health.","Module 3: Volunteer Work","Engage in volunteer roles that suit you."
80-100,Female,8,memory,"Memory Master Series","Module 1: Sharing Wisdom","Teach or share skills with others.","Module 2: Challenging Activities","Try puzzles or activities that challenge you appropriately.","Module 3: Cultural Engagement","Attend accessible cultural events."
80-100,Female,9,memory,"Memory Master Series","Module 1: Mentoring","Mentor younger generations, sharing experiences.","Module 2: Continuous Learning","Explore new topics of interest.","Module 3: Community Participation","Stay active in community circles."
80-100,Female,10,memory,"Memory Master Series","Module 1: Legacy Creation","Work on projects that reflect your life's passion.","Module 2: Memoir Writing","Write down your memories and stories.","Module 3: Leadership Roles","Lead discussions or groups if possible."
0-10,Male,0,focus,"10 Days to 10x Focus Program","Day 1: Interactive Play","Engage in simple, interactive games to capture attention.","Day 2: Short Activities","Keep tasks brief to match short attention spans.","Day 3: Positive Reinforcement","Use praise to encourage focus during activities."
0-10,Male,1,focus,"10 Days to 10x Focus Program","Day 1: Hands-On Learning","Incorporate tactile activities like building blocks.","Day 2: Story Time","Read short stories to improve listening skills.","Day 3: Routine Establishment","Create consistent daily schedules."
0-10,Male,2,focus,"10 Days to 10x Focus Program","Day 1: Matching Games","Play simple matching games to enhance attention.","Day 2: Role-Playing","Engage in role-play to maintain focus.","Day 3: Color and Shape Recognition","Use colorful objects to keep interest."
0-10,Male,3,focus,"10 Days to 10x Focus Program","Day 1: Puzzles","Introduce age-appropriate puzzles.","Day 2: Memory Games","Play games like 'Simon Says' to improve focus.","Day 3: Art Projects","Engage in simple arts and crafts."
0-10,Male,4,focus,"10 Days to 10x Focus Program","Day 1: Music and Movement","Combine music with movement activities.","Day 2: Guided Instructions","Practice following multi-step instructions.","Day 3: Outdoor Activities","Encourage focus through outdoor play."
0-10,Male,5,focus,"10 Days to 10x Focus Program","Day 1: Building Challenges","Use building blocks for focused tasks.","Day 2: Interactive Reading","Ask questions during story time.","Day 3: Simple Tasks","Assign small responsibilities to enhance focus."
0-10,Female,0,focus,"10 Days to 10x Focus Program","Day 1: Sensory Play","Engage in sensory activities like sand play.","Day 2: Singing Songs","Use songs with actions to maintain attention.","Day 3: Short Storytelling","Tell brief stories to capture interest."
0-10,Female,1,focus,"10 Days to 10x Focus Program","Day 1: Color Games","Play games identifying colors and shapes.","Day 2: Dress-Up Play","Engage in pretend play to enhance focus.","Day 3: Repetition Activities","Repeat fun activities to keep attention."
0-10,Female,2,focus,"10 Days to 10x Focus Program","Day 1: Arts and Crafts","Introduce simple craft projects.","Day 2: Matching Games","Play matching card games.","Day 3: Interactive Songs","Sing songs that require participation."
0-10,Female,3,focus,"10 Days to 10x Focus Program","Day 1: Storytelling Participation","Encourage her to participate in storytelling.","Day 2: Dance Activities","Use dance to foster attention and focus.","Day 3: Simple Board Games","Play easy board games requiring turn-taking."
0-10,Female,4,focus,"10 Days to 10x Focus Program","Day 1: Cooking Together","Make simple recipes together.","Day 2: Puzzle Time","Engage in puzzles to enhance concentration.","Day 3: Nature Exploration","Focus on observing nature during walks."
0-10,Female,5,focus,"10 Days to 10x Focus Program","Day 1: Memory Games","Play 'Memory' card game to improve focus.","Day 2: Role-Playing Activities","Act out stories or situations.","Day 3: Collaborative Projects","Work on group crafts or activities."
0-10,Male,6,focus,"10 Days to 10x Focus Program","Day 1: Advanced Puzzles","Introduce more challenging puzzles to enhance concentration.","Day 2: Team Sports","Engage in simple team sports to improve focus and cooperation.","Day 3: Musical Instrument","Begin learning a simple instrument to develop sustained attention."
0-10,Male,7,focus,"10 Days to 10x Focus Program","Day 1: Coding Games","Use basic coding apps or toys to enhance problem-solving and focus.","Day 2: Science Experiments","Conduct simple experiments requiring attention to detail.","Day 3: Strategy Games","Play games requiring planning, such as checkers or strategy-based apps."
0-10,Male,8,focus,"10 Days to 10x Focus Program","Day 1: Reading Sessions","Encourage reading longer books independently to improve focus.","Day 2: Memory Challenges","Set tasks that require sustained concentration, like memory recall games.","Day 3: Independent Projects","Start small projects that span several days to build persistence."
0-10,Male,9,focus,"10 Days to 10x Focus Program","Day 1: Leadership Activities","Encourage leading group activities to foster responsibility and focus.","Day 2: Complex Crafts","Engage in crafts that require attention over extended periods.","Day 3: Outdoor Exploration","Participate in nature studies that require observation and focus."
0-10,Male,10,focus,"10 Days to 10x Focus Program","Day 1: Advanced Strategy Games","Play complex games like chess to enhance strategic focus.","Day 2: Long-Term Projects","Begin projects spanning multiple days, like model building.","Day 3: Public Speaking","Practice presenting topics to improve confidence and concentration."
0-10,Female,6,focus,"10 Days to 10x Focus Program","Day 1: Detailed Arts","Engage in art projects that require careful attention to detail.","Day 2: Dance Routines","Learn and practice complex dance sequences.","Day 3: Science Exploration","Conduct simple science experiments to encourage focused observation."
0-10,Female,7,focus,"10 Days to 10x Focus Program","Day 1: Musical Instrument","Begin lessons on a simple instrument to improve focus and discipline.","Day 2: Writing Stories","Encourage writing and illustrating short stories.","Day 3: Team Activities","Participate in team projects that require cooperation and focus."
0-10,Female,8,focus,"10 Days to 10x Focus Program","Day 1: Book Clubs","Join or create a book club to discuss readings and enhance focus.","Day 2: Advanced Crafts","Work on intricate crafts like knitting or jewelry making.","Day 3: Memory Games","Play complex memory games to improve attention."
0-10,Female,9,focus,"10 Days to 10x Focus Program","Day 1: Leadership Roles","Lead group discussions or projects to build focus and leadership skills.","Day 2: Long-Term Projects","Embark on projects requiring sustained effort, like a garden.","Day 3: Public Speaking","Practice presenting to an audience to enhance concentration."
0-10,Female,10,focus,"10 Days to 10x Focus Program","Day 1: Creative Writing","Write and illustrate a short book to foster deep focus.","Day 2: Community Projects","Participate in service activities requiring commitment and attention.","Day 3: Advanced Learning","Explore topics of interest in depth to encourage sustained focus."
10-20,Male,0,focus,"10 Days to 10x Focus Program","Day 1: Identify Distractions","List common distractions affecting your focus.","Day 2: Organize Workspace","Set up a clutter-free study area.","Day 3: Set Clear Goals","Define specific goals for each study session."
10-20,Male,1,focus,"10 Days to 10x Focus Program","Day 1: Time Management Basics","Allocate specific times for tasks.","Day 2: Active Listening","Practice paying full attention during classes.","Day 3: Short Focused Sessions","Work in short intervals to build concentration."
10-20,Male,2,focus,"10 Days to 10x Focus Program","Day 1: Prioritize Tasks","Rank tasks by importance and urgency.","Day 2: Eliminate Multitasking","Focus on one task at a time.","Day 3: Mindfulness Introduction","Begin simple mindfulness exercises."
10-20,Male,3,focus,"10 Days to 10x Focus Program","Day 1: Pomodoro Technique","Use timed intervals for focused work.","Day 2: Distraction Limitation","Limit use of phones and social media.","Day 3: Healthy Habits","Incorporate sleep and nutrition to aid focus."
10-20,Male,4,focus,"10 Days to 10x Focus Program","Day 1: Deep Breathing","Practice breathing exercises to enhance focus.","Day 2: Develop Routine","Establish a consistent daily schedule.","Day 3: Active Studying","Engage with material through note-taking."
10-20,Male,5,focus,"10 Days to 10x Focus Program","Day 1: Meditation Practice","Begin daily meditation for improved concentration.","Day 2: Goal Visualization","Visualize achieving your study goals.","Day 3: Physical Activity","Include exercise to boost focus."
10-20,Male,6,focus,"10 Days to 10x Focus Program","Day 1: Advanced Mindfulness","Deepen mindfulness practices.","Day 2: Cognitive Exercises","Use brain-training apps to sharpen focus.","Day 3: Optimize Environment","Adjust lighting and ergonomics for comfort."
10-20,Male,7,focus,"10 Days to 10x Focus Program","Day 1: Accountability Partner","Work with a peer to stay on track.","Day 2: Healthy Technology Use","Use apps that block distractions.","Day 3: Diet for Focus","Eat foods that support brain health."
10-20,Male,8,focus,"10 Days to 10x Focus Program","Day 1: Spaced Repetition","Use techniques to improve retention.","Day 2: Regular Exercise","Maintain fitness for cognitive benefits.","Day 3: Sleep Optimization","Prioritize sleep to enhance focus."
10-20,Male,9,focus,"10 Days to 10x Focus Program","Day 1: Teach Others","Solidify knowledge by teaching peers.","Day 2: Leadership Roles","Take on responsibilities requiring focus.","Day 3: Creative Activities","Engage in art or music to improve attention."
10-20,Male,10,focus,"10 Days to 10x Focus Program","Day 1: Flow States","Aim to reach deep focus during tasks.","Day 2: Extended Meditation","Practice longer meditation sessions.","Day 3: Mentorship","Guide others to reinforce your skills."
10-20,Female,0,focus,"10 Days to 10x Focus Program","Day 1: Recognize Distractions","Identify what disrupts your focus.","Day 2: Organize Your Space","Create a neat study environment.","Day 3: Set Simple Goals","Define small, achievable objectives."
10-20,Female,1,focus,"10 Days to 10x Focus Program","Day 1: Breaks and Rewards","Use breaks as incentives for focused work.","Day 2: Active Participation","Engage actively in learning settings.","Day 3: Short Study Sessions","Build focus through brief study periods."
10-20,Female,2,focus,"10 Days to 10x Focus Program","Day 1: Single-task Focus","Concentrate on one activity at a time.","Day 2: Basic Mindfulness","Introduce simple mindfulness techniques.","Day 3: Limit Notifications","Turn off non-essential alerts."
10-20,Female,3,focus,"10 Days to 10x Focus Program","Day 1: Structured Routine","Develop a daily schedule for consistency.","Day 2: Healthy Lifestyle","Incorporate good nutrition and sleep habits.","Day 3: Pomodoro Technique","Use timed intervals to manage study time."
10-20,Female,4,focus,"10 Days to 10x Focus Program","Day 1: Meditation Practice","Begin practicing meditation regularly.","Day 2: Distraction-Free Zone","Designate areas for focused work.","Day 3: Active Engagement","Interact with material actively."
10-20,Female,5,focus,"10 Days to 10x Focus Program","Day 1: Goal Visualization","Visualize your academic achievements.","Day 2: Physical Activity","Include exercise in your routine.","Day 3: Mindful Breaks","Take mindful breaks to rejuvenate focus."
10-20,Female,6,focus,"10 Days to 10x Focus Program","Day 1: Advanced Mindfulness","Enhance mindfulness practices.","Day 2: Brain Exercises","Engage in puzzles and cognitive games.","Day 3: Environment Optimization","Optimize your study environment."
10-20,Female,7,focus,"10 Days to 10x Focus Program","Day 1: Accountability Groups","Join study groups for shared focus.","Day 2: Technology Aids","Use focus-enhancing apps.","Day 3: Nutritious Diet","Consume foods that support cognitive function."
10-20,Female,8,focus,"10 Days to 10x Focus Program","Day 1: Study Techniques","Implement active recall and spaced repetition.","Day 2: Consistent Exercise","Maintain regular physical activity.","Day 3: Sleep Prioritization","Ensure sufficient rest each night."
10-20,Female,9,focus,"10 Days to 10x Focus Program","Day 1: Teaching Peers","Reinforce learning by teaching others.","Day 2: Leadership Opportunities","Take on roles requiring concentration.","Day 3: Creative Pursuits","Engage in arts to enhance focus."
10-20,Female,10,focus,"10 Days to 10x Focus Program","Day 1: Achieve Flow","Aim for deep focus in tasks.","Day 2: Extended Meditation","Practice longer periods of meditation.","Day 3: Mentorship","Guide others to improve your own focus skills."
20-30,Male,0,focus,"10 Days to 10x Focus Program","Day 1: Assess Focus Levels","Evaluate your current ability to focus on tasks.","Day 2: Eliminate Distractions","Identify and remove common distractions in your environment.","Day 3: Basic Time Management","Start using a simple schedule to organize your day."
20-30,Male,1,focus,"10 Days to 10x Focus Program","Day 1: Set Clear Goals","Define specific, achievable goals for work and personal life.","Day 2: Create To-Do Lists","Use daily to-do lists to stay on track.","Day 3: Limit Multitasking","Focus on one task at a time to improve concentration."
20-30,Male,2,focus,"10 Days to 10x Focus Program","Day 1: Organize Workspace","Ensure your workspace is clean and organized.","Day 2: Prioritize Tasks","Rank tasks by importance and address high-priority items first.","Day 3: Short Focused Sessions","Work in short, dedicated intervals to build focus."
20-30,Male,3,focus,"10 Days to 10x Focus Program","Day 1: Introduce Pomodoro Technique","Work in 25-minute intervals with 5-minute breaks.","Day 2: Healthy Lifestyle Basics","Start incorporating regular sleep and nutrition habits.","Day 3: Reduce Digital Distractions","Turn off non-essential notifications during focus periods."
20-30,Male,4,focus,"10 Days to 10x Focus Program","Day 1: Physical Activity","Include regular exercise to boost cognitive function.","Day 2: Mindfulness Practice","Begin simple mindfulness exercises to enhance focus.","Day 3: Time Blocking","Schedule specific times for different tasks."
20-30,Male,5,focus,"10 Days to 10x Focus Program","Day 1: Deep Work Sessions","Set aside uninterrupted blocks of time for important work.","Day 2: Healthy Eating","Adopt a diet that supports brain health and energy levels.","Day 3: Sleep Optimization","Ensure you are getting 7-8 hours of quality sleep."
20-30,Male,6,focus,"10 Days to 10x Focus Program","Day 1: Advanced Mindfulness","Practice meditation to improve sustained attention.","Day 2: Reduce Stress","Incorporate stress management techniques into your routine.","Day 3: Digital Detox","Limit screen time to reduce mental fatigue."
20-30,Male,7,focus,"10 Days to 10x Focus Program","Day 1: Goal Visualization","Visualize the successful completion of tasks.","Day 2: Accountability Partner","Work with someone to stay committed to your focus goals.","Day 3: Optimize Work Environment","Adjust lighting and ergonomics for maximum comfort."
20-30,Male,8,focus,"10 Days to 10x Focus Program","Day 1: Cognitive Training","Use brain-training apps to enhance focus and memory.","Day 2: Advanced Time Management","Implement more complex scheduling techniques.","Day 3: Regular Exercise Routine","Maintain consistent physical activity."
20-30,Male,9,focus,"10 Days to 10x Focus Program","Day 1: Flow State Techniques","Learn how to enter a flow state for deep focus.","Day 2: Reflect and Adjust","Assess which techniques work best for you and refine them.","Day 3: Leadership Opportunities","Take on roles that require sustained focus and responsibility."
20-30,Male,10,focus,"10 Days to 10x Focus Program","Day 1: Mentorship","Mentor others to reinforce your own focus abilities.","Day 2: Continuous Improvement","Commit to ongoing development of focus skills.","Day 3: Advanced Mindfulness","Deepen meditation practice for peak mental performance."
20-30,Female,0,focus,"10 Days to 10x Focus Program","Day 1: Evaluate Distractions","Identify factors that impact your concentration.","Day 2: Organize Environment","Create a tidy and inspiring workspace.","Day 3: Set Simple Goals","Establish clear, attainable daily objectives."
20-30,Female,1,focus,"10 Days to 10x Focus Program","Day 1: Create Routines","Develop consistent daily routines to foster focus.","Day 2: Limit Disruptions","Set boundaries to minimize interruptions during work.","Day 3: Short Focus Sessions","Build concentration with brief, focused periods."
20-30,Female,2,focus,"10 Days to 10x Focus Program","Day 1: Prioritize Self-Care","Incorporate basic self-care to support focus.","Day 2: Use Checklists","Track tasks with checklists to stay organized.","Day 3: Single-tasking","Practice focusing on one task without multitasking."
20-30,Female,3,focus,"10 Days to 10x Focus Program","Day 1: Healthy Habits","Begin improving sleep and nutrition for better focus.","Day 2: Basic Mindfulness","Introduce mindfulness exercises to enhance attention.","Day 3: Schedule Breaks","Plan regular short breaks to prevent burnout."
20-30,Female,4,focus,"10 Days to 10x Focus Program","Day 1: Exercise Incorporation","Add regular physical activity into your routine.","Day 2: Pomodoro Technique","Use timed work sessions to manage focus.","Day 3: Reduce Clutter","Simplify your workspace to limit distractions."
20-30,Female,5,focus,"10 Days to 10x Focus Program","Day 1: Meditation Practice","Start daily meditation to improve concentration.","Day 2: Balanced Diet","Adopt nutritional habits that support cognitive health.","Day 3: Sleep Quality","Implement practices to enhance sleep."
20-30,Female,6,focus,"10 Days to 10x Focus Program","Day 1: Advanced Organization","Use planners or digital tools to organize tasks.","Day 2: Stress Management","Incorporate techniques to reduce stress levels.","Day 3: Limit Media Consumption","Reduce time spent on social media."
20-30,Female,7,focus,"10 Days to 10x Focus Program","Day 1: Goal Setting","Define short-term and long-term goals for focus.","Day 2: Accountability Groups","Join groups to stay committed to focus objectives.","Day 3: Environment Enhancement","Personalize your workspace for inspiration."
20-30,Female,8,focus,"10 Days to 10x Focus Program","Day 1: Cognitive Exercises","Engage in activities that enhance brain function.","Day 2: Time Blocking","Allocate specific times for different tasks and activities.","Day 3: Regular Exercise","Maintain a consistent fitness regimen."
20-30,Female,9,focus,"10 Days to 10x Focus Program","Day 1: Deep Work Practice","Dedicate time for tasks requiring intense focus.","Day 2: Reflect and Adapt","Evaluate which strategies improve your focus most.","Day 3: Leadership Roles","Pursue opportunities that require sustained attention."
