age-group,gender,cumulativeScore,category,programName,heading1,description1,heading2,description2,heading3,description3
70-80,Male,8,focus,"10 Days to 10x Focus Program","Day 1: Deep Focus Activities","Engage in tasks that require sustained attention.","Day 2: Reflect and Adjust","Assess what focus strategies work best for you.","Day 3: Lifelong Learning","Pursue new knowledge to keep the mind active."
70-80,Male,9,focus,"10 Days to 10x Focus Program","Day 1: Leadership Roles","Take on roles in community groups requiring focus.","Day 2: Advanced Meditation","Deepen meditation practices for enhanced focus.","Day 3: Share Wisdom","Mentor others to reinforce your own skills."
70-80,Male,10,focus,"10 Days to 10x Focus Program","Day 1: Mastery of Focus","Engage in activities that challenge your concentration.","Day 2: Optimize Lifestyle","Fine-tune daily habits for peak cognitive performance.","Day 3: Achieve Flow States","Regularly enter deep focus during activities."
70-80,Female,0,focus,"10 Days to 10x Focus Program","Day 1: Identify Distractions","Recognize common focus challenges.","Day 2: Organize Environment","Create a peaceful space for activities.","Day 3: Set Simple Objectives","Define clear, achievable goals."
70-80,Female,1,focus,"10 Days to 10x Focus Program","Day 1: Limit Interruptions","Set boundaries to minimize disruptions.","Day 2: Develop Routine","Establish consistent daily schedules.","Day 3: Healthy Lifestyle","Ensure proper sleep and nutrition."
70-80,Female,2,focus,"10 Days to 10x Focus Program","Day 1: Focus on Single Tasks","Concentrate on one activity at a time.","Day 2: Basic Mindfulness","Incorporate simple mindfulness exercises.","Day 3: Manage Notifications","Limit distractions from devices."
70-80,Female,3,focus,"10 Days to 10x Focus Program","Day 1: Establish Routines","Create consistent habits for daily activities.","Day 2: Gentle Physical Activity","Include light exercises like stretching.","Day 3: Use Timers","Employ timers to structure focus periods."
70-80,Female,4,focus,"10 Days to 10x Focus Program","Day 1: Improve Sleep","Adopt routines for better sleep quality.","Day 2: Mindfulness Practice","Begin regular meditation sessions.","Day 3: Healthy Eating","Focus on a balanced diet to support focus."
70-80,Female,5,focus,"10 Days to 10x Focus Program","Day 1: Cognitive Exercises","Engage in puzzles and games to enhance concentration.","Day 2: Social Engagement","Participate in group activities.","Day 3: Limit Media Consumption","Reduce exposure to distracting media."
70-80,Female,6,focus,"10 Days to 10x Focus Program","Day 1: Advanced Mindfulness","Deepen meditation practice.","Day 2: Optimize Environment","Adjust living spaces for comfort and minimal distractions.","Day 3: Reflect and Adjust","Regularly assess focus strategies."
70-80,Female,7,focus,"10 Days to 10x Focus Program","Day 1: Set Goals","Define clear focus objectives.","Day 2: Accountability Partner","Work with someone to stay committed.","Day 3: Energy Management","Align activities with personal energy levels."
70-80,Female,8,focus,"10 Days to 10x Focus Program","Day 1: Lifelong Learning","Engage in educational activities to stimulate focus.","Day 2: Delegate Tasks","Seek help when needed to reduce overload.","Day 3: Regular Exercise","Maintain physical activity appropriate for health."
70-80,Female,9,focus,"10 Days to 10x Focus Program","Day 1: Leadership Opportunities","Take on roles that require sustained attention.","Day 2: Habit Optimization","Refine daily routines for better focus.","Day 3: Advanced Mindfulness","Practice deep meditation techniques."
70-80,Female,10,focus,"10 Days to 10x Focus Program","Day 1: Mentor Others","Share focus strategies with peers.","Day 2: Peak Cognitive Performance","Implement advanced techniques to maintain focus.","Day 3: Maintain Balance","Ensure a balanced lifestyle for sustained focus."
80-100,Male,0,focus,"10 Days to 10x Focus Program","Day 1: Identify Distractions","Acknowledge common distractions in your daily activities.","Day 2: Establish Simple Routines","Create consistent routines to enhance focus.","Day 3: Organize Environment","Ensure your living space is tidy and free from clutter."
80-100,Male,1,focus,"10 Days to 10x Focus Program","Day 1: Limit Multitasking","Focus on one activity at a time to improve concentration.","Day 2: Engage in Light Activity","Incorporate gentle movements or exercises.","Day 3: Mindful Listening","Practice active listening during conversations."
80-100,Male,2,focus,"10 Days to 10x Focus Program","Day 1: Structured Schedule","Develop a simple daily schedule for your activities.","Day 2: Reduce Screen Time","Limit exposure to screens before bedtime.","Day 3: Healthy Nutrition","Focus on a balanced diet to support cognitive health."
80-100,Male,3,focus,"10 Days to 10x Focus Program","Day 1: Short Focus Sessions","Engage in tasks for brief periods to build attention span.","Day 2: Mindfulness Exercises","Practice basic mindfulness techniques to enhance focus.","Day 3: Social Interaction","Participate in social activities to stimulate the mind."
80-100,Male,4,focus,"10 Days to 10x Focus Program","Day 1: Gentle Physical Activity","Incorporate regular light exercises like walking or stretching.","Day 2: Engage in Hobbies","Spend time on hobbies that require attention.","Day 3: Memory Games","Play simple games to improve focus and memory."
80-100,Male,5,focus,"10 Days to 10x Focus Program","Day 1: Deep Breathing","Practice deep breathing exercises to promote relaxation.","Day 2: Consistent Sleep Routine","Maintain regular sleep schedules for better focus.","Day 3: Healthy Eating","Consume foods rich in nutrients supporting brain health."
80-100,Male,6,focus,"10 Days to 10x Focus Program","Day 1: Advanced Mindfulness","Engage in meditation to enhance concentration.","Day 2: Puzzles and Games","Challenge your mind with puzzles appropriate for you.","Day 3: Nature Time","Spend time outdoors to refresh your mind."
80-100,Male,7,focus,"10 Days to 10x Focus Program","Day 1: Social Engagement","Join group activities to maintain mental sharpness.","Day 2: Reading Practice","Read books or articles to improve focus.","Day 3: Limit Distractions","Create a quiet environment during tasks."
80-100,Male,8,focus,"10 Days to 10x Focus Program","Day 1: Cognitive Exercises","Engage in brain-training apps or exercises.","Day 2: Consistent Routines","Strengthen focus through consistent daily habits.","Day 3: Reflective Practices","Spend time reflecting to enhance mental clarity."
80-100,Male,9,focus,"10 Days to 10x Focus Program","Day 1: Mentorship","Share your experiences to help others, reinforcing your focus.","Day 2: Advanced Meditation","Deepen your meditation practice for sustained attention.","Day 3: Lifelong Learning","Pursue learning new topics to maintain cognitive function."
80-100,Male,10,focus,"10 Days to 10x Focus Program","Day 1: Achieve Flow","Engage in activities that fully absorb you.","Day 2: Optimize Lifestyle","Fine-tune habits for optimal mental performance.","Day 3: Legacy Projects","Work on meaningful projects that require focus."
80-100,Female,0,focus,"10 Days to 10x Focus Program","Day 1: Identify Distractions","Recognize and acknowledge distractions in your environment.","Day 2: Simple Organization","Arrange your living space to be clutter-free.","Day 3: Set Daily Intentions","Define simple goals for the day."
80-100,Female,1,focus,"10 Days to 10x Focus Program","Day 1: Single-task Focus","Concentrate on one activity at a time.","Day 2: Gentle Movements","Incorporate light exercise like stretching.","Day 3: Mindful Activities","Engage in activities like knitting or painting."
80-100,Female,2,focus,"10 Days to 10x Focus Program","Day 1: Create Routine","Establish a routine for daily tasks.","Day 2: Reduce Noise","Minimize background noise during activities.","Day 3: Healthy Diet","Focus on nutrition that supports brain health."
80-100,Female,3,focus,"10 Days to 10x Focus Program","Day 1: Mindfulness Practice","Begin simple mindfulness exercises.","Day 2: Short Focus Activities","Engage in tasks for brief periods to build focus.","Day 3: Social Connections","Spend time with friends or family."
80-100,Female,4,focus,"10 Days to 10x Focus Program","Day 1: Engage in Hobbies","Pursue hobbies that require attention.","Day 2: Light Physical Activity","Include activities like walking in your routine.","Day 3: Sleep Hygiene","Maintain consistent sleep patterns."
80-100,Female,5,focus,"10 Days to 10x Focus Program","Day 1: Deep Breathing","Practice breathing exercises to relax and focus.","Day 2: Healthy Eating","Consume a balanced diet rich in essential nutrients.","Day 3: Limit Distractions","Create a peaceful environment for activities."
80-100,Female,6,focus,"10 Days to 10x Focus Program","Day 1: Advanced Mindfulness","Engage in meditation to improve concentration.","Day 2: Cognitive Games","Play puzzles or games to stimulate the mind.","Day 3: Nature Engagement","Spend time outdoors to enhance well-being."
80-100,Female,7,focus,"10 Days to 10x Focus Program","Day 1: Reading Practice","Read books or stories to improve focus.","Day 2: Social Activities","Participate in group activities or clubs.","Day 3: Consistent Routines","Maintain regular daily habits."
80-100,Female,8,focus,"10 Days to 10x Focus Program","Day 1: Brain Exercises","Engage in activities that challenge your mind.","Day 2: Reflective Practice","Spend time journaling or reflecting.","Day 3: Healthy Lifestyle","Maintain overall wellness for better focus."
80-100,Female,9,focus,"10 Days to 10x Focus Program","Day 1: Mentorship","Share knowledge or skills with others.","Day 2: Deep Meditation","Deepen mindfulness practices.","Day 3: Lifelong Learning","Continue learning new things to stimulate the mind."
80-100,Female,10,focus,"10 Days to 10x Focus Program","Day 1: Achieve Flow","Engage deeply in activities that you enjoy.","Day 2: Optimize Habits","Refine daily routines for optimal focus.","Day 3: Create Legacy","Work on meaningful projects or memoirs."
0-10,Male,0,attention,"Attention Span 200","Week 1: Interactive Play","Engage in simple interactive games to capture attention.","Week 2: Short Activities","Use brief tasks to match attention spans.","Week 3: Positive Reinforcement","Provide praise to encourage focused behavior."
0-10,Male,1,attention,"Attention Span 200","Week 1: Sensory Activities","Use sensory play to stimulate attention.","Week 2: Matching Games","Play basic matching games.","Week 3: Story Time","Read short stories to maintain interest."
0-10,Male,2,attention,"Attention Span 200","Week 1: Music and Movement","Incorporate songs with actions.","Week 2: Hands-On Learning","Use tactile activities to engage attention.","Week 3: Routine Building","Establish consistent daily routines."
0-10,Male,3,attention,"Attention Span 200","Week 1: Puzzles","Introduce age-appropriate puzzles.","Week 2: Memory Games","Play games like 'Simon Says' to improve attention.","Week 3: Outdoor Play","Engage in outdoor activities to channel energy."
0-10,Male,4,attention,"Attention Span 200","Week 1: Art Projects","Encourage drawing and coloring.","Week 2: Role-Playing","Use dress-up and pretend play.","Week 3: Group Activities","Participate in group games to develop attention."
0-10,Male,5,attention,"Attention Span 200","Week 1: Simple Chores","Assign small tasks to build responsibility.","Week 2: Interactive Reading","Ask questions during story time.","Week 3: Cooking Together","Engage in simple cooking activities."
0-10,Female,0,attention,"Attention Span 200","Week 1: Sensory Play","Engage in activities like sand or water play.","Week 2: Singing Songs","Use songs and rhymes to capture attention.","Week 3: Short Stories","Read brief, engaging stories."
0-10,Female,1,attention,"Attention Span 200","Week 1: Color Games","Play games identifying colors and shapes.","Week 2: Dress-Up Play","Encourage pretend play to enhance attention.","Week 3: Repetitive Activities","Use repetitive songs or actions."
0-10,Female,2,attention,"Attention Span 200","Week 1: Arts and Crafts","Introduce simple crafts to focus attention.","Week 2: Matching Games","Play matching card games.","Week 3: Interactive Songs","Sing songs with movements."
0-10,Female,3,attention,"Attention Span 200","Week 1: Storytelling Participation","Encourage participation during story time.","Week 2: Dance Activities","Use dance to promote attention and coordination.","Week 3: Simple Board Games","Play turn-taking games."
0-10,Female,4,attention,"Attention Span 200","Week 1: Cooking Activities","Engage in making simple snacks.","Week 2: Puzzle Time","Introduce puzzles to enhance attention.","Week 3: Nature Walks","Explore outdoors to observe and focus."
0-10,Female,5,attention,"Attention Span 200","Week 1: Memory Games","Play games to improve attention and recall.","Week 2: Role-Playing","Participate in role-play activities.","Week 3: Collaborative Projects","Work on group crafts."
0-10,Male,6,attention,"Attention Span 200","Week 1: Science Exploration","Conduct simple science experiments to foster curiosity and attention.","Week 2: Team Sports","Engage in team games to improve cooperative attention.","Week 3: Musical Instrument","Begin learning a simple instrument to enhance sustained attention."
0-10,Male,7,attention,"Attention Span 200","Week 1: Complex Puzzles","Introduce challenging puzzles to improve attention span.","Week 2: Strategy Games","Play strategy-based games to encourage focused thinking.","Week 3: Reading Sessions","Read longer stories to enhance listening attention."
0-10,Male,8,attention,"Attention Span 200","Week 1: Coding Activities","Use basic coding apps or toys to develop attention to detail.","Week 2: Art Projects","Engage in detailed art projects requiring sustained attention.","Week 3: Memory Challenges","Participate in memory games that require focused attention."
0-10,Male,9,attention,"Attention Span 200","Week 1: Leadership Roles","Encourage taking lead in group activities to build attention skills.","Week 2: Long-Term Projects","Begin projects that require planning and sustained attention over time.","Week 3: Advanced Music Lessons","Continue with music learning at a more advanced level."
0-10,Male,10,attention,"Attention Span 200","Week 1: Public Speaking","Practice presentations to improve attention and confidence.","Week 2: Advanced Strategy Games","Engage in complex games like chess.","Week 3: Community Projects","Participate in community service requiring focus and attention."
0-10,Female,6,attention,"Attention Span 200","Week 1: Dance and Choreography","Learn dance routines to enhance attention and memory.","Week 2: Musical Instrument","Begin learning a simple instrument.","Week 3: Reading Clubs","Join a reading club to improve sustained attention."
0-10,Female,7,attention,"Attention Span 200","Week 1: Creative Writing","Encourage writing stories or poems.","Week 2: Detailed Crafts","Engage in crafts that require attention to detail.","Week 3: Science Experiments","Conduct experiments to foster curiosity and focus."
0-10,Female,8,attention,"Attention Span 200","Week 1: Team Sports","Participate in team sports to improve attention and cooperation.","Week 2: Art Projects","Work on intricate art projects.","Week 3: Memory Games","Play advanced memory games."
0-10,Female,9,attention,"Attention Span 200","Week 1: Leadership Opportunities","Take on leadership roles in group activities.","Week 2: Long-Term Projects","Start projects that require extended focus.","Week 3: Advanced Music Lessons","Continue music education at a higher level."
0-10,Female,10,attention,"Attention Span 200","Week 1: Community Involvement","Participate in community service projects.","Week 2: Public Speaking","Practice presentations to enhance attention and confidence.","Week 3: Advanced Learning","Engage in topics of interest deeply to improve focus."
10-20,Male,0,attention,"Attention Span 200","Week 1: Identify Distractions","List common distractions affecting your attention.","Week 2: Organize Study Space","Set up a clean, quiet environment for studying.","Week 3: Short Study Sessions","Begin with brief, focused study periods."
10-20,Male,1,attention,"Attention Span 200","Week 1: Set Clear Goals","Define specific, achievable objectives for each session.","Week 2: Limit Multitasking","Focus on one task at a time to improve attention.","Week 3: Active Listening","Practice full engagement during classes."
10-20,Male,2,attention,"Attention Span 200","Week 1: Time Management","Use planners to schedule study times and breaks.","Week 2: Turn Off Notifications","Disable non-essential device notifications.","Week 3: Interactive Learning","Engage with material through note-taking."
10-20,Male,3,attention,"Attention Span 200","Week 1: Pomodoro Technique","Use timed intervals (e.g., 25 minutes) for studying.","Week 2: Mindfulness Introduction","Begin practicing basic mindfulness exercises.","Week 3: Healthy Habits","Incorporate sleep and nutrition for better attention."
10-20,Male,4,attention,"Attention Span 200","Week 1: Minimize Distractions","Identify and reduce sources of distractions.","Week 2: Breaks and Rewards","Use short breaks as incentives for focused work.","Week 3: Physical Activity","Include exercise to improve attention."
10-20,Male,5,attention,"Attention Span 200","Week 1: Goal Setting","Set long-term academic goals to maintain motivation.","Week 2: Group Study","Engage in study groups to stay attentive.","Week 3: Mindful Breathing","Practice breathing exercises to enhance focus."
10-20,Male,6,attention,"Attention Span 200","Week 1: Advanced Mindfulness","Deepen mindfulness practices to improve attention.","Week 2: Healthy Lifestyle","Maintain consistent sleep, diet, and exercise routines.","Week 3: Cognitive Games","Play brain-training games to sharpen attention."
10-20,Male,7,attention,"Attention Span 200","Week 1: Technology Management","Use apps to limit digital distractions.","Week 2: Leadership Roles","Take on responsibilities requiring sustained attention.","Week 3: Regular Reflection","Assess attention strategies and adjust as needed."
10-20,Male,8,attention,"Attention Span 200","Week 1: Advanced Study Techniques","Implement methods like spaced repetition.","Week 2: Physical Fitness","Maintain an active lifestyle to support cognitive function.","Week 3: Sleep Optimization","Ensure quality sleep for better attention."
10-20,Male,9,attention,"Attention Span 200","Week 1: Teach Others","Explain concepts to peers to reinforce attention.","Week 2: Creative Pursuits","Engage in arts or music to enhance focus.","Week 3: Meditation Retreat","Consider attending a mindfulness retreat."
10-20,Male,10,attention,"Attention Span 200","Week 1: Achieving Flow","Work towards entering flow states during tasks.","Week 2: Deep Work Sessions","Dedicate time to intensive focus without interruptions.","Week 3: Mentorship","Help others improve attention to reinforce your own skills."
10-20,Female,0,attention,"Attention Span 200","Week 1: Recognize Distractions","Identify factors impacting your attention.","Week 2: Organize Workspace","Create a clean, inspiring study area.","Week 3: Set Simple Goals","Define small, achievable objectives."
10-20,Female,1,attention,"Attention Span 200","Week 1: Limit Multitasking","Focus on one activity at a time to enhance attention.","Week 2: Healthy Habits","Begin incorporating proper sleep and nutrition.","Week 3: Active Participation","Engage actively in learning settings."
10-20,Female,2,attention,"Attention Span 200","Week 1: Time Management","Use planners or apps to schedule tasks.","Week 2: Reduce Screen Time","Limit non-essential device usage during study.","Week 3: Interactive Learning","Use methods like note-taking to stay attentive."
10-20,Female,3,attention,"Attention Span 200","Week 1: Pomodoro Technique","Adopt timed study intervals with breaks.","Week 2: Mindfulness Introduction","Start basic mindfulness exercises.","Week 3: Physical Activity","Include regular exercise for cognitive benefits."
10-20,Female,4,attention,"Attention Span 200","Week 1: Set Clear Goals","Define specific academic objectives.","Week 2: Group Studies","Collaborate with peers to maintain attention.","Week 3: Minimize Distractions","Identify and eliminate distractions."
10-20,Female,5,attention,"Attention Span 200","Week 1: Advanced Mindfulness","Deepen mindfulness practices.","Week 2: Healthy Lifestyle","Maintain consistent routines for sleep and diet.","Week 3: Brain Exercises","Engage in activities that challenge attention."
10-20,Female,6,attention,"Attention Span 200","Week 1: Time Blocking","Schedule dedicated time blocks for study.","Week 2: Accountability Partner","Work with someone to stay focused.","Week 3: Cognitive Training","Use apps to enhance attention skills."
10-20,Female,7,attention,"Attention Span 200","Week 1: Leadership Roles","Take on positions that require sustained attention.","Week 2: Reflective Practices","Regularly assess and adjust attention strategies.","Week 3: Creative Outlets","Engage in creative activities to improve focus."
10-20,Female,8,attention,"Attention Span 200","Week 1: Advanced Study Techniques","Implement spaced repetition and active recall.","Week 2: Physical Wellness","Maintain exercise for cognitive support.","Week 3: Sleep Optimization","Ensure quality sleep each night."
10-20,Female,9,attention,"Attention Span 200","Week 1: Teach Others","Explain subjects to peers to reinforce your own attention.","Week 2: Art and Music","Pursue artistic endeavors to enhance focus.","Week 3: Mindfulness Retreat","Consider attending a meditation retreat."
10-20,Female,10,attention,"Attention Span 200","Week 1: Achieving Flow","Aim to enter flow states during academic work.","Week 2: Intensive Focus Sessions","Dedicated periods of deep work without disruptions.","Week 3: Mentorship","Guide others to solidify your own attention skills."
20-30,Male,0,attention,"Attention Span 200","Week 1: Identify Distractions","List common distractions affecting your attention.","Week 2: Organize Workspace","Create a clean and quiet work environment.","Week 3: Short Focus Sessions","Begin with brief periods of focused work."
20-30,Male,1,attention,"Attention Span 200","Week 1: Set Clear Goals","Define specific and achievable objectives.","Week 2: Limit Multitasking","Focus on one task at a time.","Week 3: Active Listening","Practice full engagement in conversations and meetings."
20-30,Male,2,attention,"Attention Span 200","Week 1: Time Management","Use planners to schedule tasks and appointments.","Week 2: Reduce Digital Distractions","Turn off non-essential notifications on devices.","Week 3: Healthy Lifestyle","Incorporate regular sleep and nutrition habits."
20-30,Male,3,attention,"Attention Span 200","Week 1: Pomodoro Technique","Utilize timed intervals for work and rest.","Week 2: Mindfulness Introduction","Begin practicing mindfulness exercises.","Week 3: Physical Activity","Include regular exercise to enhance focus."
20-30,Male,4,attention,"Attention Span 200","Week 1: Minimize Distractions","Identify and eliminate sources of distraction.","Week 2: Goal Visualization","Visualize successful completion of tasks.","Week 3: Breaks and Rewards","Use breaks as incentives for focused work."
20-30,Male,5,attention,"Attention Span 200","Week 1: Advanced Mindfulness","Enhance mindfulness practices to improve attention.","Week 2: Healthy Diet","Adopt a diet that supports brain function.","Week 3: Cognitive Exercises","Engage in brain-training apps or games."
20-30,Male,6,attention,"Attention Span 200","Week 1: Time Blocking","Schedule specific times for tasks and activities.","Week 2: Accountability Partner","Work with someone to stay on track.","Week 3: Stress Management","Implement techniques to reduce stress."
20-30,Male,7,attention,"Attention Span 200","Week 1: Sleep Optimization","Ensure quality sleep for better attention.","Week 2: Leadership Opportunities","Take on roles requiring sustained attention.","Week 3: Reflective Practices","Regularly assess attention strategies."
20-30,Male,8,attention,"Attention Span 200","Week 1: Advanced Study Techniques","Implement methods like spaced repetition.","Week 2: Physical Fitness","Maintain an active lifestyle to support attention.","Week 3: Limit Screen Time","Reduce unnecessary screen exposure."
20-30,Male,9,attention,"Attention Span 200","Week 1: Teach Others","Reinforce attention by teaching concepts.","Week 2: Creative Pursuits","Engage in artistic or musical activities.","Week 3: Meditation Retreat","Consider participating in a mindfulness retreat."
20-30,Male,10,attention,"Attention Span 200","Week 1: Deep Work Sessions","Schedule uninterrupted blocks for complex tasks.","Week 2: Achieve Flow","Work towards entering flow states during work.","Week 3: Continuous Improvement","Commit to ongoing attention development."
20-30,Female,0,attention,"Attention Span 200","Week 1: Recognize Attention Challenges","Identify specific areas impacting attention.","Week 2: Organize Workspace","Create a conducive environment for focus.","Week 3: Set Small Goals","Establish attainable daily objectives."
20-30,Female,1,attention,"Attention Span 200","Week 1: Limit Multitasking","Focus on one activity at a time.","Week 2: Healthy Habits","Ensure adequate sleep and nutrition.","Week 3: Active Participation","Engage fully in meetings and discussions."
20-30,Female,2,attention,"Attention Span 200","Week 1: Time Management","Use planners or apps to schedule tasks.","Week 2: Reduce Distractions","Limit non-essential technology during focus times.","Week 3: Interactive Learning","Stay engaged through active note-taking."
20-30,Female,3,attention,"Attention Span 200","Week 1: Pomodoro Technique","Employ timed intervals for work and rest.","Week 2: Mindfulness Introduction","Begin basic mindfulness practices.","Week 3: Physical Activity","Incorporate regular exercise."
