age-group,gender,cumulativeScore,category,programName,heading1,description1,heading2,description2,heading3,description3
60-70,Female,9,attention,"Attention Span 200","Week 1: Community Involvement","Take on roles in community groups requiring focus.","Week 2: Mentorship","Share experiences to reinforce attention skills.","Week 3: Healthy Lifestyle","Prioritize overall well-being."
60-70,Female,10,attention,"Attention Span 200","Week 1: Achieving Flow","Engage deeply in meaningful activities.","Week 2: Optimize Habits","Refine routines for peak focus.","Week 3: Legacy Projects","Contribute to projects that require sustained attention."
70-80,Male,0,attention,"Attention Span 200","Week 1: Recognize Distractions","Identify common distractions affecting attention.","Week 2: Establish Simple Routines","Create consistent daily activities to promote focus.","Week 3: Organize Environment","Maintain a tidy and quiet space for activities."
70-80,Male,1,attention,"Attention Span 200","Week 1: Single-Task Focus","Concentrate on one task at a time.","Week 2: Short Activities","Engage in brief tasks to build attention span.","Week 3: Healthy Habits","Ensure adequate rest and nutrition."
70-80,Male,2,attention,"Attention Span 200","Week 1: Reduce Screen Time","Limit exposure to screens before bedtime.","Week 2: Gentle Physical Activity","Include light exercises like walking.","Week 3: Social Interaction","Engage in conversations to stimulate attention."
70-80,Male,3,attention,"Attention Span 200","Week 1: Mindfulness Introduction","Practice basic mindfulness exercises.","Week 2: Set Simple Goals","Define small, achievable daily tasks.","Week 3: Cognitive Games","Play simple puzzles or games to enhance attention."
70-80,Male,4,attention,"Attention Span 200","Week 1: Establish Routine","Create consistent daily schedules to enhance focus.","Week 2: Healthy Eating","Adopt a diet that supports brain health.","Week 3: Memory Exercises","Engage in activities that challenge memory."
70-80,Male,5,attention,"Attention Span 200","Week 1: Mindfulness Practice","Begin regular meditation to improve attention.","Week 2: Physical Activity","Maintain regular exercise appropriate for ability.","Week 3: Social Engagement","Participate in group activities."
70-80,Male,6,attention,"Attention Span 200","Week 1: Cognitive Stimulation","Engage in brain-training exercises.","Week 2: Limit Multitasking","Focus on one activity at a time.","Week 3: Environment Optimization","Ensure your space is comfortable and distraction-free."
70-80,Male,7,attention,"Attention Span 200","Week 1: Goal Setting","Define clear, attainable goals for daily activities.","Week 2: Accountability Measures","Use reminders or notes to stay on task.","Week 3: Reflect and Adjust","Assess attention strategies and make adjustments."
70-80,Male,8,attention,"Attention Span 200","Week 1: Advanced Mindfulness","Deepen meditation practices to enhance focus.","Week 2: Regular Exercise","Maintain consistent physical activity for cognitive health.","Week 3: Lifelong Learning","Engage in new learning opportunities."
70-80,Male,9,attention,"Attention Span 200","Week 1: Community Involvement","Take on roles in community groups requiring attention.","Week 2: Mentoring","Share knowledge to reinforce your own attention skills.","Week 3: Healthy Lifestyle","Continue to prioritize overall wellness."
70-80,Male,10,attention,"Attention Span 200","Week 1: Achieving Flow","Engage in activities that fully absorb your attention.","Week 2: Optimize Habits","Refine routines for optimal focus.","Week 3: Legacy Projects","Contribute to projects that require sustained attention."
70-80,Female,0,attention,"Attention Span 200","Week 1: Recognize Distractions","Identify common attention challenges.","Week 2: Organize Environment","Create a comfortable and quiet space for activities.","Week 3: Set Simple Objectives","Define achievable daily tasks."
70-80,Female,1,attention,"Attention Span 200","Week 1: Single-Task Focus","Concentrate on one activity at a time.","Week 2: Short Sessions","Engage in brief tasks to build attention span.","Week 3: Healthy Habits","Ensure adequate rest and nutrition."
70-80,Female,2,attention,"Attention Span 200","Week 1: Reduce Screen Time","Limit device use, especially before bedtime.","Week 2: Gentle Movement","Incorporate light exercises like stretching.","Week 3: Social Activities","Engage in social interactions to stimulate the mind."
70-80,Female,3,attention,"Attention Span 200","Week 1: Mindfulness Introduction","Start practicing basic mindfulness exercises.","Week 2: Establish Routine","Create consistent daily schedules.","Week 3: Cognitive Activities","Engage in puzzles or simple games."
70-80,Female,4,attention,"Attention Span 200","Week 1: Healthy Eating","Focus on a diet that supports cognitive health.","Week 2: Sleep Optimization","Ensure restful sleep for better attention.","Week 3: Hobbies","Participate in hobbies that require attention."
70-80,Female,5,attention,"Attention Span 200","Week 1: Mindfulness Practice","Begin regular meditation to enhance focus.","Week 2: Physical Activity","Maintain regular exercise appropriate for your health.","Week 3: Creative Expression","Engage in art or music activities."
70-80,Female,6,attention,"Attention Span 200","Week 1: Cognitive Stimulation","Engage in activities that challenge the brain.","Week 2: Limit Multitasking","Focus on one activity at a time to enhance attention.","Week 3: Environment Optimization","Ensure your space is conducive to focus."
70-80,Female,7,attention,"Attention Span 200","Week 1: Goal Setting","Define clear and attainable daily goals.","Week 2: Social Engagement","Participate in group activities to maintain attention.","Week 3: Reflect and Adjust","Assess strategies and make necessary adjustments."
70-80,Female,8,attention,"Attention Span 200","Week 1: Advanced Mindfulness","Deepen meditation practices for better attention.","Week 2: Regular Exercise","Maintain consistent physical activity.","Week 3: Lifelong Learning","Explore new topics to keep the mind active."
70-80,Female,9,attention,"Attention Span 200","Week 1: Community Involvement","Take on roles in community groups requiring focus.","Week 2: Mentorship","Share experiences to reinforce attention skills.","Week 3: Healthy Lifestyle","Prioritize overall well-being."
70-80,Female,10,attention,"Attention Span 200","Week 1: Achieving Flow","Engage deeply in meaningful activities.","Week 2: Optimize Habits","Refine routines for peak focus.","Week 3: Legacy Projects","Contribute to projects that require sustained attention."
80-100,Male,0,attention,"Attention Span 200","Week 1: Recognize Distractions","Identify distractions affecting your attention in daily activities.","Week 2: Establish Simple Routines","Create consistent daily routines to support focus.","Week 3: Organize Environment","Maintain a tidy, quiet space for activities."
80-100,Male,1,attention,"Attention Span 200","Week 1: Single-Task Focus","Focus on one activity at a time to improve attention.","Week 2: Short Sessions","Engage in brief activities to build attention span.","Week 3: Healthy Habits","Ensure adequate rest and proper nutrition."
80-100,Male,2,attention,"Attention Span 200","Week 1: Reduce Screen Time","Limit exposure to screens before bedtime.","Week 2: Gentle Physical Activity","Include light exercises such as walking or stretching.","Week 3: Social Interaction","Engage in conversations to stimulate the mind."
80-100,Male,3,attention,"Attention Span 200","Week 1: Mindfulness Introduction","Practice basic mindfulness exercises to enhance focus.","Week 2: Set Simple Goals","Define small, achievable daily tasks.","Week 3: Cognitive Games","Engage in simple puzzles or games to improve attention."
80-100,Male,4,attention,"Attention Span 200","Week 1: Establish Routine","Create consistent daily schedules to enhance focus.","Week 2: Healthy Eating","Adopt a diet that supports cognitive health.","Week 3: Memory Exercises","Participate in activities that challenge memory."
80-100,Male,5,attention,"Attention Span 200","Week 1: Mindfulness Practice","Begin regular meditation to improve attention.","Week 2: Physical Activity","Maintain appropriate exercise for your ability.","Week 3: Social Engagement","Join group activities to stimulate attention."
80-100,Male,6,attention,"Attention Span 200","Week 1: Cognitive Stimulation","Engage in brain-training exercises suitable for you.","Week 2: Limit Multitasking","Focus on one task at a time to enhance attention.","Week 3: Environment Optimization","Ensure your space is comfortable and free of distractions."
80-100,Male,7,attention,"Attention Span 200","Week 1: Goal Setting","Define clear, attainable goals for daily activities.","Week 2: Accountability Measures","Use reminders or notes to stay focused.","Week 3: Reflect and Adjust","Assess attention strategies and adjust as needed."
80-100,Male,8,attention,"Attention Span 200","Week 1: Advanced Mindfulness","Deepen meditation practices to enhance focus.","Week 2: Regular Exercise","Maintain consistent physical activity appropriate for your health.","Week 3: Lifelong Learning","Engage in new learning opportunities to stimulate attention."
80-100,Male,9,attention,"Attention Span 200","Week 1: Community Involvement","Participate in community groups requiring attention.","Week 2: Mentoring","Share knowledge to reinforce your own attention skills.","Week 3: Healthy Lifestyle","Continue to prioritize overall wellness for optimal attention."
80-100,Male,10,attention,"Attention Span 200","Week 1: Achieving Flow","Engage in activities that fully capture your attention.","Week 2: Optimize Habits","Refine routines for peak focus and attention.","Week 3: Legacy Projects","Contribute to meaningful projects requiring sustained attention."
80-100,Female,0,attention,"Attention Span 200","Week 1: Recognize Distractions","Identify common distractions in daily life.","Week 2: Organize Environment","Create a comfortable and quiet space for activities.","Week 3: Set Simple Objectives","Define achievable daily tasks to enhance focus."
80-100,Female,1,attention,"Attention Span 200","Week 1: Single-Task Focus","Concentrate on one activity at a time to improve attention.","Week 2: Short Sessions","Engage in brief activities to build attention span.","Week 3: Healthy Habits","Ensure adequate rest and proper nutrition."
80-100,Female,2,attention,"Attention Span 200","Week 1: Reduce Screen Time","Limit device use, especially before sleep.","Week 2: Gentle Movement","Include light exercises like stretching.","Week 3: Social Activities","Engage in social interactions to stimulate the mind."
80-100,Female,3,attention,"Attention Span 200","Week 1: Mindfulness Introduction","Start practicing basic mindfulness exercises.","Week 2: Establish Routine","Create consistent daily schedules.","Week 3: Cognitive Activities","Engage in simple puzzles or games to enhance attention."
80-100,Female,4,attention,"Attention Span 200","Week 1: Healthy Eating","Focus on a diet that supports cognitive health.","Week 2: Sleep Optimization","Ensure restful sleep to improve attention.","Week 3: Hobbies","Participate in hobbies that require focus."
80-100,Female,5,attention,"Attention Span 200","Week 1: Mindfulness Practice","Begin regular meditation to enhance focus.","Week 2: Physical Activity","Maintain regular exercise appropriate for your health.","Week 3: Creative Expression","Engage in art or music activities to improve attention."
80-100,Female,6,attention,"Attention Span 200","Week 1: Cognitive Stimulation","Engage in activities that challenge the brain.","Week 2: Limit Multitasking","Focus on one task at a time to enhance attention.","Week 3: Environment Optimization","Ensure your space is conducive to focus."
80-100,Female,7,attention,"Attention Span 200","Week 1: Goal Setting","Define clear and attainable daily goals.","Week 2: Social Engagement","Participate in group activities to maintain attention.","Week 3: Reflect and Adjust","Assess strategies and adjust as needed."
80-100,Female,8,attention,"Attention Span 200","Week 1: Advanced Mindfulness","Deepen meditation practices for better attention.","Week 2: Regular Exercise","Maintain consistent physical activity suitable for your health.","Week 3: Lifelong Learning","Explore new topics to keep the mind active."
80-100,Female,9,attention,"Attention Span 200","Week 1: Community Involvement","Take on roles in community groups requiring focus.","Week 2: Mentorship","Share experiences to reinforce your own attention skills.","Week 3: Healthy Lifestyle","Prioritize overall well-being to support attention."
80-100,Female,10,attention,"Attention Span 200","Week 1: Achieving Flow","Engage deeply in meaningful activities that absorb your attention.","Week 2: Optimize Habits","Refine routines for peak focus and cognitive function.","Week 3: Legacy Projects","Contribute to projects requiring sustained attention and focus."
0-10,Male,0,puzzleSolving,"Problem Solving Pro","Module 1: Simple Shape Sorters","Introduce shape sorting toys to develop basic problem-solving skills.","Module 2: Cause and Effect Play","Use toys that demonstrate cause and effect, like push-and-go cars.","Module 3: Building Blocks","Play with blocks to encourage exploration and problem-solving."
0-10,Male,1,puzzleSolving,"Problem Solving Pro","Module 1: Matching Games","Play simple matching games to enhance cognitive abilities.","Module 2: Puzzles","Introduce basic puzzles with few pieces.","Module 3: Interactive Play","Engage in play that requires making choices, like choosing the right tool."
0-10,Male,2,puzzleSolving,"Problem Solving Pro","Module 1: Sequencing Activities","Arrange objects in order to develop logical thinking.","Module 2: Story Time Questions","Ask questions during stories to stimulate thinking.","Module 3: Simple Board Games","Play games that require decision-making."
0-10,Male,3,puzzleSolving,"Problem Solving Pro","Module 1: Pattern Recognition","Use beads or blocks to create and recognize patterns.","Module 2: Maze Activities","Introduce simple mazes to navigate.","Module 3: Role-Playing","Encourage problem-solving through pretend play."
0-10,Male,4,puzzleSolving,"Problem Solving Pro","Module 1: Advanced Puzzles","Increase puzzle difficulty with more pieces.","Module 2: Construction Toys","Use Lego or similar toys to build structures.","Module 3: Memory Games","Play games that require remembering sequences."
0-10,Male,5,puzzleSolving,"Problem Solving Pro","Module 1: Logic Games","Introduce age-appropriate logic games or apps.","Module 2: Science Experiments","Conduct simple experiments to understand problem-solving steps.","Module 3: Strategy Games","Play basic strategy games like Tic-Tac-Toe."
0-10,Female,0,puzzleSolving,"Problem Solving Pro","Module 1: Sensory Play","Use sensory bins to explore and solve simple problems.","Module 2: Shape Matching","Play with shape sorters to develop cognitive skills.","Module 3: Storytelling with Choices","Tell stories that involve making choices."
0-10,Female,1,puzzleSolving,"Problem Solving Pro","Module 1: Basic Puzzles","Introduce simple puzzles with large pieces.","Module 2: Dress-Up Games","Use dress-up to encourage creative problem-solving.","Module 3: Matching Activities","Play matching games with images or objects."
0-10,Female,2,puzzleSolving,"Problem Solving Pro","Module 1: Sorting Activities","Sort objects by size, color, or type.","Module 2: Building Towers","Use blocks to build and understand balance.","Module 3: Role-Playing Scenarios","Create play scenarios that require problem-solving."
0-10,Female,3,puzzleSolving,"Problem Solving Pro","Module 1: Pattern Activities","Create and recognize patterns with beads.","Module 2: Simple Coding Toys","Use toys that introduce basic coding logic.","Module 3: Memory Matching","Play memory card games to enhance recall."
0-10,Female,4,puzzleSolving,"Problem Solving Pro","Module 1: Advanced Puzzles","Use puzzles with more pieces and complexity.","Module 2: Cooking Projects","Engage in simple cooking to follow steps.","Module 3: Story Sequencing","Arrange story cards in order."
0-10,Female,5,puzzleSolving,"Problem Solving Pro","Module 1: Strategy Games","Play simple games that require planning ahead.","Module 2: Science Exploration","Conduct easy experiments to understand cause and effect.","Module 3: Creative Problem Solving","Encourage finding multiple solutions to a problem."
0-10,Male,6,puzzleSolving,"Problem Solving Pro","Module 1: Intermediate Coding","Use coding toys or apps to introduce sequencing and logic.","Module 2: Advanced Puzzles","Engage with puzzles that have increased complexity.","Module 3: Strategy Games","Play games like checkers or simple strategy-based apps."
0-10,Male,7,puzzleSolving,"Problem Solving Pro","Module 1: Building Projects","Create models using building kits with instructions.","Module 2: Science Experiments","Conduct experiments that require hypothesis and observation.","Module 3: Problem-Solving Challenges","Set tasks that require planning and creative solutions."
0-10,Male,8,puzzleSolving,"Problem Solving Pro","Module 1: Robotics Kits","Introduce basic robotics to enhance engineering skills.","Module 2: Chess Introduction","Begin learning chess to develop strategic thinking.","Module 3: Math Puzzles","Solve age-appropriate math puzzles and riddles."
0-10,Male,9,puzzleSolving,"Problem Solving Pro","Module 1: Coding Projects","Start simple programming projects using kid-friendly languages.","Module 2: Engineering Challenges","Build structures with specific goals, like bridges or towers.","Module 3: Logic Puzzles","Work on challenging logic puzzles to enhance reasoning."
0-10,Male,10,puzzleSolving,"Problem Solving Pro","Module 1: Advanced Problem Solving","Engage in complex problem-solving activities and competitions.","Module 2: Leadership Roles","Take lead in group projects requiring problem-solving skills.","Module 3: Advanced Coding","Dive deeper into programming concepts and applications."
0-10,Female,6,puzzleSolving,"Problem Solving Pro","Module 1: Story-Based Coding","Use coding apps that incorporate storytelling to teach logic.","Module 2: Complex Crafts","Engage in crafts that require planning and problem-solving.","Module 3: Science Exploration","Conduct experiments to foster inquiry and reasoning."
0-10,Female,7,puzzleSolving,"Problem Solving Pro","Module 1: Design Challenges","Create designs or models with specific constraints.","Module 2: Strategy Games","Play strategic board games to enhance thinking skills.","Module 3: Math Challenges","Solve mathematical puzzles appropriate for their age."
0-10,Female,8,puzzleSolving,"Problem Solving Pro","Module 1: Robotics Introduction","Explore robotics kits aimed at developing engineering interests.","Module 2: Advanced Puzzles","Work on puzzles with higher piece counts and complexity.","Module 3: Creative Solutions","Encourage finding multiple solutions to open-ended problems."
0-10,Female,9,puzzleSolving,"Problem Solving Pro","Module 1: Coding Clubs","Join or form coding clubs to enhance programming skills.","Module 2: Leadership in Projects","Lead group projects requiring problem-solving and collaboration.","Module 3: Critical Thinking","Engage in activities that require deep reasoning and logic."
0-10,Female,10,puzzleSolving,"Problem Solving Pro","Module 1: Advanced Projects","Undertake complex projects like building simple machines.","Module 2: Mentoring","Teach problem-solving skills to younger children or peers.","Module 3: STEM Exploration","Dive into science, technology, engineering, and math topics."
10-20,Male,0,puzzleSolving,"Problem Solving Pro","Module 1: Study Skills Foundation","Learn basic study techniques to enhance problem-solving.","Module 2: Simple Puzzles","Work on easy puzzles to build logical thinking.","Module 3: Interactive Learning","Engage in activities that require basic decision-making."
10-20,Male,1,puzzleSolving,"Problem Solving Pro","Module 1: Basic Logic Games","Play simple logic games to improve reasoning.","Module 2: Group Projects","Participate in collaborative tasks to develop problem-solving skills.","Module 3: Hands-On Experiments","Conduct basic experiments to understand cause and effect."
10-20,Male,2,puzzleSolving,"Problem Solving Pro","Module 1: Coding Introduction","Begin learning basic programming concepts.","Module 2: Advanced Puzzles","Challenge yourself with more complex puzzles.","Module 3: Strategic Games","Play games like chess to develop strategic thinking."
10-20,Male,3,puzzleSolving,"Problem Solving Pro","Module 1: STEM Activities","Engage in science, technology, engineering, and math projects.","Module 2: Critical Thinking Exercises","Practice exercises that enhance critical thinking.","Module 3: Problem-Solving Workshops","Attend workshops focused on developing problem-solving techniques."
10-20,Male,4,puzzleSolving,"Problem Solving Pro","Module 1: Coding Projects","Work on small programming projects to apply logic.","Module 2: Math Competitions","Participate in math contests to challenge reasoning skills.","Module 3: Robotics Clubs","Join a robotics club to build and program robots."
10-20,Male,5,puzzleSolving,"Problem Solving Pro","Module 1: Advanced Strategy Games","Play complex strategy games to improve planning and foresight.","Module 2: Engineering Challenges","Participate in engineering competitions or challenges.","Module 3: Scientific Research","Begin conducting simple research projects."
10-20,Male,6,puzzleSolving,"Problem Solving Pro","Module 1: Algorithm Design","Learn about algorithms and their applications.","Module 2: Creative Problem Solving","Find innovative solutions to open-ended problems.","Module 3: Leadership in Projects","Take leadership roles in group problem-solving tasks."
10-20,Male,7,puzzleSolving,"Problem Solving Pro","Module 1: Advanced Coding","Develop proficiency in programming languages.","Module 2: Peer Tutoring","Teach problem-solving strategies to younger students.","Module 3: Competitive Robotics","Participate in robotics competitions."
10-20,Male,8,puzzleSolving,"Problem Solving Pro","Module 1: Research Methodologies","Learn how to conduct thorough research.","Module 2: Complex Projects","Work on multidisciplinary projects requiring problem-solving.","Module 3: Innovation and Invention","Invent new devices or solutions to existing problems."
10-20,Male,9,puzzleSolving,"Problem Solving Pro","Module 1: Advanced Mathematics","Study higher-level math to enhance analytical skills.","Module 2: Coding Competitions","Enter programming contests to test problem-solving under pressure.","Module 3: Science Fairs","Present research findings at science fairs."
10-20,Male,10,puzzleSolving,"Problem Solving Pro","Module 1: Thought Leadership","Lead initiatives that require high-level problem-solving.","Module 2: Mentoring Programs","Mentor peers in developing problem-solving skills.","Module 3: Innovation Labs","Participate in labs focusing on cutting-edge technology."
10-20,Female,0,puzzleSolving,"Problem Solving Pro","Module 1: Study Foundations","Develop effective study habits to support problem-solving.","Module 2: Simple Crafts","Engage in crafts that require following instructions.","Module 3: Group Activities","Collaborate on simple projects with peers."
10-20,Female,1,puzzleSolving,"Problem Solving Pro","Module 1: Introduction to Coding","Learn basic programming concepts through interactive tools.","Module 2: Story-Based Problem Solving","Use storytelling to develop logical thinking.","Module 3: Puzzle Challenges","Solve puzzles to enhance reasoning."
10-20,Female,2,puzzleSolving,"Problem Solving Pro","Module 1: Math Puzzles","Engage in mathematical games and puzzles.","Module 2: Creative Workshops","Attend workshops that combine creativity and problem-solving.","Module 3: Team Projects","Collaborate on projects requiring planning."
10-20,Female,3,puzzleSolving,"Problem Solving Pro","Module 1: Science Experiments","Conduct experiments to understand scientific principles.","Module 2: Coding Clubs","Join coding clubs to learn programming with peers.","Module 3: Strategic Games","Play games that require planning and strategy."
10-20,Female,4,puzzleSolving,"Problem Solving Pro","Module 1: Robotics Introduction","Explore basic robotics through kits and clubs.","Module 2: Advanced Crafts","Work on crafts that require precision and problem-solving.","Module 3: Critical Thinking Exercises","Engage in activities that promote analytical thinking."
10-20,Female,5,puzzleSolving,"Problem Solving Pro","Module 1: Coding Projects","Develop small programming projects.","Module 2: Leadership Roles","Take on leadership positions in group projects.","Module 3: Debate Clubs","Participate in debates to enhance reasoning skills."
10-20,Female,6,puzzleSolving,"Problem Solving Pro","Module 1: Advanced Mathematics","Study higher-level math topics to sharpen analytical skills.","Module 2: Innovation Challenges","Participate in competitions requiring creative solutions.","Module 3: Mentorship","Mentor younger students in problem-solving."
10-20,Female,7,puzzleSolving,"Problem Solving Pro","Module 1: Research Projects","Conduct in-depth research on topics of interest.","Module 2: Coding Competitions","Compete in programming contests.","Module 3: STEM Outreach","Lead initiatives to encourage STEM among peers."
10-20,Female,8,puzzleSolving,"Problem Solving Pro","Module 1: Scientific Research","Engage in serious scientific research projects.","Module 2: Engineering Design","Work on engineering projects, designing innovative solutions.","Module 3: Innovation Incubators","Join programs that foster inventive thinking."
